<?xml version="1.0" encoding="UTF-8"?>
<zones xmlns="stendhal" xmlns:xsi="http://www.w3.org/2001/XMLSchema-instance"
	xsi:schemaLocation="stendhal ../zones.xsd ">
 <!--
   ** Load zones. Written from left to right and from top to bottom.
   ** Please respect it!
   -->


 <!--  Level 6 -->


 <!--  Level 5 -->


 <!--  Level 4 -->


 <!--  Level 3 -->


 <!--  Level 2 -->


 <!--  Level 1 -->


 <!--  Ground level -->
 <zone name="int_amazon_princess_hut" file="interiors/amazon/princess_hut.tmx">
 <configurator class-name="games.stendhal.server.maps.amazon.hut.PrincessNPC"/>
  <portal x="10" y="18" ref="out">
   <destination zone="0_amazon_island_ne" ref="in"/>
  </portal>
 </zone>

 <zone name="int_amazon_prison_hut" file="interiors/amazon/prison_hut.tmx">
 <configurator class-name="games.stendhal.server.maps.amazon.hut.JailedBarbNPC"/>
  <portal x="7" y="14" ref="out">
   <destination zone="0_amazon_island_sw" ref="in"/>
  </portal>
 </zone>

 <zone name="0_amazon_island_nw" level="0" x="501024" y="499744" file="Level 0/amazon/island_nw.tmx">
 </zone>

 <zone name="0_amazon_island_ne" level="0" x="501152" y="499744" file="Level 0/amazon/island_ne.tmx">
  <configurator class-name="games.stendhal.server.maps.amazon.fleamarket.AmazonMermaidArmorNPC"/>
 <entity x="11" y="81">
     <implementation class-name="games.stendhal.server.entity.mapstuff.sign.Sign"/>
     <attribute name="text">
I buy good, quality cloaks:

elf cloak  50
lich cloak  10000
xeno cloak  18000
stone cloak  350
vampire cloak  14000
red dragon cloak  4000
blue striped cloak 280
     </attribute>
     <attribute name="class">blackboard</attribute>
    </entity>
  <portal x="48" y="98" ref="in">
   <destination zone="int_amazon_princess_hut" ref="out"/>
  </portal>
 </zone>

 <zone name="0_amazon_island_sw" level="0" x="501024" y="499872" file="Level 0/amazon/island_sw.tmx">
  <portal x="64" y="26" ref="in">
   <destination zone="int_amazon_prison_hut" ref="out"/>
  </portal>
 </zone>

 <zone name="0_amazon_island_se" level="0" x="501152" y="499872" file="Level 0/amazon/island_se.tmx">
 </zone>

  <!--  Level -1 -->
 <zone name="-1_amazon_caves" level="-1" x="501152" y="499744" file="Level -1/amazon/caves.tmx">
 </zone>

 <zone name="-1_amazon_tunnel_e" level="-1" x="501024" y="499744" file="Level -1/amazon/tunnel_e.tmx">
 </zone>

 <zone name="-1_amazon_tunnel" level="-1" x="500896" y="499744" file="Level -1/amazon/tunnel.tmx">
 </zone>
 
 <!--  Level -2 -->


 <!--  Level -3 -->


 <!--  Level -4 -->


 <!--  Level -5 -->


 <!--  Level -6 -->


 <!--  Level -7 -->

</zones>
