<?xml version="1.0" encoding="UTF-8"?>
<!-- <!DOCTYPE zones SYSTEM "zones.dtd"> -->
<zones xmlns="stendhal" xmlns:xsi="http://www.w3.org/2001/XMLSchema-instance"
	xsi:schemaLocation="stendhal zones.xsd ">
 <!--
   ** Load zones. Written from left to right and from top to bottom.
   ** Please respect it!
   -->

 <!-- Level 7 -->

 <zone name="7_kikareukin_clouds" level="7" x="499616" y="499744" file="Level 7/kikareukin/clouds.tmx">
<!--Don't allow teleporting as we don't want marked scrolls made or ring abused-->
  <configurator class-name="games.stendhal.server.core.config.zone.NoTeleport"/>
  <portal x="29" y="6" ref="exit1">
   <destination zone="6_kikareukin_islands" ref="cloud_exit1"/>
  </portal>
  <portal x="9" y="47" ref="exit2">
   <destination zone="6_kikareukin_islands" ref="cloud_exit2"/>
  </portal>
  <portal x="51" y="18" ref="exit3">
   <destination zone="6_kikareukin_islands" ref="cloud_exit3"/>
  </portal>
 </zone>

 <!-- Level 6 -->

 <zone name="6_kikareukin_islands" level="6" x="499616" y="499744" file="Level 6/kikareukin/islands.tmx">
  <portal x="66" y="63" ref="exit">
   <destination zone="0_semos_mountain_n_w4" ref="kikareukin_exit"/>
  </portal>
  <portal x="25" y="8" ref="cloud_exit1">
   <implementation class-name="games.stendhal.server.entity.mapstuff.portal.OneWayPortalDestination"/>
  </portal>
  <portal x="6" y="110" ref="cloud_exit2">
   <implementation class-name="games.stendhal.server.entity.mapstuff.portal.OneWayPortalDestination"/>
  </portal>
  <portal x="93" y="9" ref="cloud_exit3">
   <implementation class-name="games.stendhal.server.entity.mapstuff.portal.OneWayPortalDestination"/>
  </portal>
 </zone>


 <!-- Level 5 -->

 <zone name="5_kikareukin_cave" level="5" x="499616" y="499744" file="Level 5/kikareukin/cave.tmx">
 </zone>


 <!-- Level 4 -->

 <zone name="4_kikareukin_cave" level="4" x="499616" y="499744" file="Level 4/kikareukin/cave.tmx">
 </zone>


 <!-- Level 3 -->

 <zone name="3_kikareukin_cave" level="3" x="499616" y="499744" file="Level 3/kikareukin/cave.tmx">
 </zone>


 <!-- Level 2 -->

 <zone name="2_kikareukin_cave" level="2" x="499616" y="499744" file="Level 2/kikareukin/cave.tmx">
 </zone>


 <!-- Level 1 -->

 <zone name="1_kikareukin_cave" level="1" x="499616" y="499744" file="Level 1/kikareukin/cave.tmx">
  <portal x="16" y="96" ref="entrance">
   <destination zone="0_semos_mountain_n_w4" ref="kikareukin_entrance"/>
  </portal>
 </zone>


 <!-- Level 0 (Ground) -->


 <!-- Level -1 -->


 <!-- Level -2 -->


 <!-- Level -3 -->


 <!-- Level -4 -->


 <!-- Level -5 -->


 <!-- Level -6 -->


 <!-- Level -7 -->

</zones>
